url,titulo,desconto,precoOriginal,precoAVista,precoAPrazo,descricao,images,atributos
https://www.netshoes.com.br/tenis-mizuno-wave-titan-2-preto-2FU-6367-006,Tênis Mizuno Wave Titan 2 - Preto,31,349.99,227.99,239.99,"*Possui forma pequena, para um melhor ajuste nos pés, recomendamos a compra de um tamanho maior do que o seu usual.* Aposte no conforto e qualidade do novo Tênis de Corrida Masculino da Mizuno para te acompanhar nos seus treinos diários. Com design moderno, o running indicado para caminhadas e corridas leves possui cabedal fabricado com material macio e respirável que garante mais frescor durante o uso. O calcanhar é acolchoado e oferece suporte aos pés enquanto o cadarço garante ajuste eficaz. A entressola em EVA conta com tecnologia que proporciona alto nível de maciez entre uma passada e outra; e o solado de borracha proporciona aderência e tração por onde você passar. Indicado para corredores de pisada neutra, o Tênis Masculino Mizuno acompanha os corredores mais ambiciosos na busca pelo melhor pace. Aproveite!","[""https://static.netshoes.com.br/produtos/tenis-mizuno-wave-titan-2/06/2FU-6367-006/2FU-6367-006_zoom1.jpg?ts=1657368380&"",""https://static.netshoes.com.br/produtos/tenis-mizuno-wave-titan-2/06/2FU-6367-006/2FU-6367-006_zoom2.jpg?ts=1657368380&"",""https://static.netshoes.com.br/produtos/tenis-mizuno-wave-titan-2/06/2FU-6367-006/2FU-6367-006_zoom3.jpg?ts=1657368380&"",""https://static.netshoes.com.br/produtos/tenis-mizuno-wave-titan-2/06/2FU-6367-006/2FU-6367-006_zoom4.jpg?ts=1657368380&"",""https://static.netshoes.com.br/produtos/tenis-mizuno-wave-titan-2/06/2FU-6367-006/2FU-6367-006_zoom5.jpg?ts=1657368380&""]","{""Nome"":""Tênis Mizuno Wave Titan 2"",""Gênero"":""Unissex"",""Indicado para"":""Dia a Dia"",""Material"":""Têxtil e Sintético"",""Categoria"":""Caminhada"",""Composição"":""Cabedal: Têxtil com tiras sintéticas, calcanhar acolchoado e fecho em cadarço; Entressola: EVA; Solado: Borracha"",""Tecnologia"":""Wave"",""Pisada"":""Neutra"",""Definição da Tecnologia"":""Tecnologia que garante 100% da performance do sistema, proporcionando maior absorção de impacto, máximo amortecimento e estabilidade"",""Importante"":""Possui forma pequena, para um melhor ajuste nos pés, recomendamos a compra de um tamanho maior do que o seu usual."",""Garantia do Fabricante"":""Contra defeito de fabricação"",""Origem"":""Nacional"",""Marca"":""Mizuno""}"
https://www.netshoes.com.br/tenis-slip-on-redley-originals-masculino-preto-F62-1000-006,Tênis Slip On Redley Originals Masculino - Preto,NaN,219,219,219,"Ideal para os rolês ou para usar no dia a dia, esse Tênis Slip On Redley Originals Masculino possui design moderno e versátil para complementar o seu surfwear com estilo e conforto. É confeccionado em material macio ao toque da pele, calcanhar acolchoado e solado em borracha para maior resistência ao desgaste. Peça já o seu slip on masculino Redley! *Para um melhor ajuste nos pés, recomendamos a compra de um tamanho menor do que o seu usual. Forma grande.","[""https://static.netshoes.com.br/produtos/tenis-slip-on-redley-originals-masculino/06/F62-1000-006/F62-1000-006_zoom1.jpg?ts=1680638576&"",""https://static.netshoes.com.br/produtos/tenis-slip-on-redley-originals-masculino/06/F62-1000-006/F62-1000-006_zoom2.jpg?ts=1680638576&"",""https://static.netshoes.com.br/produtos/tenis-slip-on-redley-originals-masculino/06/F62-1000-006/F62-1000-006_zoom3.jpg?ts=1680638576&"",""https://static.netshoes.com.br/produtos/tenis-slip-on-redley-originals-masculino/06/F62-1000-006/F62-1000-006_zoom4.jpg?ts=1680638576&"",""https://static.netshoes.com.br/produtos/tenis-slip-on-redley-originals-masculino/06/F62-1000-006/F62-1000-006_zoom5.jpg?ts=1680638576&"",""https://static.netshoes.com.br/produtos/tenis-slip-on-redley-originals-masculino/06/F62-1000-006/F62-1000-006_zoom6.jpg?ts=1680638576&"",""https://static.netshoes.com.br/produtos/tenis-slip-on-redley-originals-masculino/06/F62-1000-006/F62-1000-006_zoom7.jpg?ts=1680638576&""]","{""Nome"":""Tênis Slip On Redley Originals Masculino"",""Gênero"":""Masculino"",""Indicado para"":""Dia a Dia"",""Altura do Cano"":""Cano Baixo"",""Material"":""Lona"",""OBS"":""Para um melhor ajuste nos pés, recomendamos a compra de um tamanho menor do que o seu usual. Forma grande."",""Composição"":""Cabedal: Têxtil. Solado: Borracha."",""Peso do Produto"":""432 g (O peso do produto vária de acordo com a númeração)"",""Garantia do Fabricante"":""Contra defeito de fabricação"",""Origem"":""Nacional"",""Marca"":""Redley""}"
https://www.netshoes.com.br/creatine-turbo-300g-black-skull-natural-G54-4177-001,Creatine Turbo 300g Black Skull,33,99.9,66.9,66.9,"A Creatine Turbo® da linha Caveira Preta Series® da Black Skull USA™ é um suplemento a base de Creatina Monohidratada e Maltodextrina. Onde é comprovado que, a utilização de carboidratos em conjunto com a creatina, promove maior eficácia no efeito da creatina, além do carboidrato agir no aumento de energia, visando apoiar seus resultados nas atividades físicas, oferecendo maior energia e consecutivamente, melhor desempenho. Com seus benefícios, apoia também o ganho de massa e a conclusão dos treinos mantendo a qualidade de suas repetições.  Sendo recomendado o consumo de 6g  ao dia. INGREDIENTES: Creatina Monohidratada e maltodextrina. NÃO CONTEM GLÚTEN.  COMO CONSUMIR? Adicionar 1 ¼ (6g) do Creatine Turbo® em 150ml de água e consumir uma vez ao dia ou conforme recomendação do fabricante. Importante que seu consumo esteja associado a uma alimentação equilibarada.  SAIBA MAIS: CREATINA A creatina é um composto de aminoácido criado pelos rins, fígado e pâncreas, por meio dos aminoácidos arginina e glicina, presentes nos alimentos com carnes e peixes, sendo que a cada 1kg de carne vermelha, encontra-se 5g de creatina. O uso desse suplemento sempre esteve em alta no mercado devido sua função de fortalecimento de energia temporária, aumento de força e promove a hipertrofia devido ao aumento de força e volume de treinamento.","[""https://static.netshoes.com.br/produtos/creatine-turbo-300g-black-skull/01/G54-4177-001/G54-4177-001_zoom1.jpg?ts=1650625727&"",""https://static.netshoes.com.br/produtos/creatine-turbo-300g-black-skull/01/G54-4177-001/G54-4177-001_zoom2.jpg?ts=1650625727&""]","{""Nome"":""Creatine Turbo 300g Black Skull"",""Gênero"":""Unissex"",""Indicado para"":""Auxilia Ganho de Energia"",""Glúten"":""Não Contém"",""Marca"":""Black Skull""}"
https://www.netshoes.com.br/tenis-fila-trend-20-preto+vermelho-2FT-6914-002,Tênis Fila Trend 2.0 - Preto+Vermelho,NaN,269.9,249.9,249.9,"Se você busca conforto durante a corrida, o Tênis Fila Trend é para você! . Fabricado com material macio ao toque, esse tênis de corrida masculino possui tecnologia que garante maior memória e resiliência do material, além de ótimo estímulo e resposta ao impacto. Seja na rua ou na esteira, o Tênis Masculino da Fila é a escolha certa para um melhor desempenho. Nome: Tênis Fila Trend Masculino. Gênero: Masculino. Indicado para: Corrida. Material: Sintético e Têxtil. Categoria: Amortecimento. Composição: Cabedal: Têxtil Sintético; Solado: Sintético. Tecnologia: Superfoam. Definição da Tecnologia: Composição do EVA que garante maior memória e resiliência do material, além de ótimo estímulo e resposta ao impacto. Garantia do Fabricante: Contra defeito de fabricação. Origem: Nacional. Marca: Fila.","[""https://static.netshoes.com.br/produtos/tenis-fila-trend-20/02/2FT-6914-002/2FT-6914-002_zoom1.jpg?ts=1678988783&"",""https://static.netshoes.com.br/produtos/tenis-fila-trend-20/02/2FT-6914-002/2FT-6914-002_zoom2.jpg?ts=1678988783&"",""https://static.netshoes.com.br/produtos/tenis-fila-trend-20/02/2FT-6914-002/2FT-6914-002_zoom3.jpg?ts=1678988783&"",""https://static.netshoes.com.br/produtos/tenis-fila-trend-20/02/2FT-6914-002/2FT-6914-002_zoom4.jpg?ts=1678988783&""]","{""Nome"":""Tênis Fila Trend 2.0"",""Gênero"":""Masculino"",""Indicado para"":""Dia a Dia"",""Marca"":""Fila""}"
https://www.netshoes.com.br/creatina-monohidratada-500g-100-pura-importada-soldiers-nutrition-sem+sabor-I0Y-0012-289,Creatina Monohidratada 500g - 100% Pura Importada - Soldiers Nutrition,NaN,119.9,119.9,119.9,"Creatina Monohidratada 500g - 100% Pura Importada - Soldiers NutritionAcompanha Dosadora 3gSOMOS FABRICANTES, PRODUTO DIRETO DA FÁBRICA PARA VOCÊ COM TOTAL GARANTIA DE QUALIDADEANVISA:Registro ISENTO conforme resolução RDC 27 de 06 de agosto de 2010 anexo I.Registro ISENTO conforme resolução RDC 240/2018.O QUE É?Acreatinaé um derivado de aminoácidos obtida através da dieta de síntese por nosso próprio organismo. Ela está presente essencialmente no músculo e auxilia na manutenção dos níveis de energia durante períodos breves de exercício intenso. Ou seja, sua função é crucial nos treinos com muito peso na busca pelo ganho de massa.Beneficios:•Aumenta a capacidade domúsculo de gerar força•Aumento de massa magra•Aumento da capacidade de treinamento•Previne o catabolismo muscularQUANTO TOMAR/MELHOR HORÁRIO PARA CONSUMOO suplemento decreatinaapresenta seus benefícios através de uso crônico, após iniciado o consumo ela deve ser ingerida todos os dias, levarão alguns dias até que os benefícios possam ser observados na sua totalidade.creatinaé insulinodependente, isso significa que é preciso consumi-la junto com /suplementos que influenciem a produção de insulina. A lista de itens que possui este efeito envolve carboidratos de alto índice glicêmico como dextrose, maltodextrina, pão e proteínas de alto índice insulinêmico como leite e whey protein.A sugestão de consumo determinada pela ANVISA é de 3gr ao dia.Não existe consenso entre pesquisadores sobre o melhor horário para consumo, existem evidencias que apontam para maiores benefícios quando consumida na refeição pré-treino, assim como também existem evidencias para melhores benefícios quando consumida junto com a refeição pós-treino.Modo de Preparo: Diluir 3g (1 dosadora) dacreatinaem 200ml de água ou bebida de sua preferência.Consumir uma porção ao dia ou conforme recomendação do nutricionista ou médico.","[""https://static.netshoes.com.br/produtos/creatina-monohidratada-500g-100-pura-importada-soldiers-nutrition/89/I0Y-0012-289/I0Y-0012-289_zoom1.jpg?ts=1666803367&"",""https://static.netshoes.com.br/produtos/creatina-monohidratada-500g-100-pura-importada-soldiers-nutrition/89/I0Y-0012-289/I0Y-0012-289_zoom2.jpg?ts=1666803367&"",""https://static.netshoes.com.br/produtos/creatina-monohidratada-500g-100-pura-importada-soldiers-nutrition/89/I0Y-0012-289/I0Y-0012-289_zoom3.jpg?ts=1666803367&""]","{""Nome"":""Creatina Monohidratada 500g - 100% Pura Importada - Soldiers Nutrition"",""Gênero"":""Unissex"",""Indicado para"":""Auxilia Ganho de Energia"",""Glúten"":""Não Contém"",""Marca"":""Soldiers Nutrition""}"
